<?xml version="1.0" encoding="UTF-8" ?>
<banks xmlns:xsi="http://www.w3.org/2001/XMLSchema-instance"
       xsi:noNamespaceSchemaLocation="Banks.xsd">
    <bank>
        <bank_name>Bank of America</bank_name>
        <country>USA</country>
        <depositor_name>John Doe</depositor_name>
        <deposit_type>TERM</deposit_type>
        <amount_on_deposit>10000.50</amount_on_deposit>
        <profitability>5.5</profitability>
        <time_constrains>P2Y</time_constrains>
    </bank>
    <bank>
        <bank_name>Santander</bank_name>
        <country>Poland</country>
        <depositor_name>Mike Wazowski</depositor_name>
        <id>1231</id>
        <deposit_type>CHECKING</deposit_type>
        <amount_on_deposit>1200.58</amount_on_deposit>
        <profitability>0</profitability>
        <time_constrains>P0Y11M0D</time_constrains>
    </bank>
    <bank>
        <bank_name>Deutsche Bank</bank_name>
        <country>Germany</country>
        <depositor_name>Hans MÃ¼ller</depositor_name>
        <id>789654</id>
        <deposit_type>SAVINGS</deposit_type>
        <amount_on_deposit>25000.75</amount_on_deposit>
        <profitability>3.2</profitability>
        <time_constrains>P3Y6M</time_constrains>
    </bank>
    <bank>
        <bank_name>BNP Paribas</bank_name>
        <country>France</country>
        <depositor_name>Amelie Dupont</depositor_name>
        <id>564738</id>
        <deposit_type>METALLIC</deposit_type>
        <amount_on_deposit>8500.00</amount_on_deposit>
        <profitability>4.0</profitability>
        <time_constrains>P1Y</time_constrains>
    </bank>
    <bank>
        <bank_name>HSBC</bank_name>
        <country>UK</country>
        <depositor_name>James Smith</depositor_name>
        <id>453276</id>
        <deposit_type>DEMAND</deposit_type>
        <amount_on_deposit>14000.33</amount_on_deposit>
        <profitability>2.5</profitability>
        <time_constrains>P2Y3M</time_constrains>
    </bank>
    <bank>
        <bank_name>ING Bank</bank_name>
        <country>Netherlands</country>
        <depositor_name>Sophie van Dijk</depositor_name>
        <id>782342</id>
        <deposit_type>TERM</deposit_type>
        <amount_on_deposit>5600.20</amount_on_deposit>
        <profitability>3.8</profitability>
        <time_constrains>P5Y</time_constrains>
    </bank>
    <bank>
        <bank_name>Bank of China</bank_name>
        <country>China</country>
        <depositor_name>Wei Zhang</depositor_name>
        <id>998231</id>
        <deposit_type>CHECKING</deposit_type>
        <amount_on_deposit>1200.00</amount_on_deposit>
        <profitability>1.0</profitability>
        <time_constrains>P1Y0M10D</time_constrains>
    </bank>
    <bank>
        <bank_name>UniCredit</bank_name>
        <country>Italy</country>
        <depositor_name>Giulia Rossi</depositor_name>
        <id>341234</id>
        <deposit_type>SAVINGS</deposit_type>
        <amount_on_deposit>7000.45</amount_on_deposit>
        <profitability>2.9</profitability>
        <time_constrains>P3Y</time_constrains>
    </bank>
    <bank>
        <bank_name>Raiffeisen Bank</bank_name>
        <country>Austria</country>
        <depositor_name>Karl Steiner</depositor_name>
        <id>459283</id>
        <deposit_type>METALLIC</deposit_type>
        <amount_on_deposit>3400.15</amount_on_deposit>
        <profitability>5.1</profitability>
        <time_constrains>P4Y2M</time_constrains>
    </bank>
    <bank>
        <bank_name>Credit Suisse</bank_name>
        <country>Switzerland</country>
        <depositor_name>Elena Fischer</depositor_name>
        <id>764839</id>
        <deposit_type>TERM</deposit_type>
        <amount_on_deposit>15000.90</amount_on_deposit>
        <profitability>3.0</profitability>
        <time_constrains>P2Y</time_constrains>
    </bank>
    <bank>
        <bank_name>Sberbank</bank_name>
        <country>Russia</country>
        <depositor_name>Ivan Petrov</depositor_name>
        <id>543672</id>
        <deposit_type>CHECKING</deposit_type>
        <amount_on_deposit>2300.10</amount_on_deposit>
        <profitability>0.8</profitability>
        <time_constrains>P6M</time_constrains>
    </bank>
    <bank>
        <bank_name>Scotiabank</bank_name>
        <country>Canada</country>
        <depositor_name>Emma Brown</depositor_name>
        <id>873621</id>
        <deposit_type>SAVINGS</deposit_type>
        <amount_on_deposit>19500.00</amount_on_deposit>
        <profitability>2.7</profitability>
        <time_constrains>P3Y1M</time_constrains>
    </bank>
    <bank>
        <bank_name>Commonwealth Bank</bank_name>
        <country>Australia</country>
        <depositor_name>Oliver Green</depositor_name>
        <id>125637</id>
        <deposit_type>TERM</deposit_type>
        <amount_on_deposit>6800.77</amount_on_deposit>
        <profitability>4.3</profitability>
        <time_constrains>P4Y</time_constrains>
    </bank>
    <bank>
        <bank_name>NORDEA</bank_name>
        <country>Sweden</country>
        <depositor_name>Sofia Lund</depositor_name>
        <id>674982</id>
        <deposit_type>METALLIC</deposit_type>
        <amount_on_deposit>4300.89</amount_on_deposit>
        <profitability>3.9</profitability>
        <time_constrains>P2Y6M</time_constrains>
    </bank>
    <bank>
        <bank_name>HSBC</bank_name>
        <country>UK</country>
        <depositor_name>Sarah Connor</depositor_name>
        <id>345678</id>
        <deposit_type>SAVINGS</deposit_type>
        <amount_on_deposit>5000.00</amount_on_deposit>
        <profitability>1.8</profitability>
        <time_constrains>P5Y</time_constrains>
    </bank>

    <bank>
        <bank_name>Deutsche Bank</bank_name>
        <country>Germany</country>
        <depositor_name>James Bond</depositor_name>
        <id>987654</id>
        <deposit_type>CHECKING</deposit_type>
        <amount_on_deposit>3500.75</amount_on_deposit>
        <profitability>0.5</profitability>
        <time_constrains>P1Y2M</time_constrains>
    </bank>

    <bank>
        <bank_name>Bank of China</bank_name>
        <country>China</country>
        <depositor_name>Li Wei</depositor_name>
        <id>987123</id>
        <deposit_type>TERM</deposit_type>
        <amount_on_deposit>20000.00</amount_on_deposit>
        <profitability>4.5</profitability>
        <time_constrains>P10Y</time_constrains>
    </bank>

    <bank>
        <bank_name>Citibank</bank_name>
        <country>USA</country>
        <depositor_name>Michael Scott</depositor_name>
        <id>564738</id>
        <deposit_type>SAVINGS</deposit_type>
        <amount_on_deposit>8000.30</amount_on_deposit>
        <profitability>2.0</profitability>
        <time_constrains>P3Y</time_constrains>
    </bank>
    <bank>
        <bank_name>JPMorgan Chase</bank_name>
        <country>USA</country>
        <depositor_name>Alice Wonderland</depositor_name>
        <id>112233</id>
        <deposit_type>METALLIC</deposit_type>
        <amount_on_deposit>15000.00</amount_on_deposit>
        <profitability>3.2</profitability>
        <time_constrains>P7Y</time_constrains>
    </bank>

    <bank>
        <bank_name>Barclays</bank_name>
        <country>UK</country>
        <depositor_name>Peter Parker</depositor_name>
        <id>556677</id>
        <deposit_type>CHECKING</deposit_type>
        <amount_on_deposit>1000.00</amount_on_deposit>
        <profitability>0.0</profitability>
        <time_constrains>P0Y5M</time_constrains>
    </bank>
</banks>